{
  "model_name": "logit",
  "model_version": "country_week_onset_logit_30d",
  "target_name": "country_week_onset_30d",
  "horizon_days": 30,
  "published_at": "2026-03-29T00:34:18.086724Z",
  "stale_after": "2026-04-19T00:34:18.086724Z",
  "baseline_used": false,
  "primary_target": "onset",
  "alert_type": "No Clear Leader",
  "model_status": "monitoring_only",
  "metrics": {
    "brier_score": 0.09190185724206953,
    "roc_auc": 0.038399353274050085,
    "precision_at_10": 0.0,
    "recall_at_5": 1.0,
    "recall_at_10": 1.0,
    "episode_recall": 1.0,
    "false_alerts_per_true_alert": 4.0,
    "no_clear_leader_rate": 0.9484848484848485
  },
  "threshold_policy": {
    "publish_top_n": 10,
    "publish_threshold": 0.008849557522123894,
    "alert_threshold": 0.008849557522123894,
    "warning_threshold": 0.5,
    "operating_threshold": 0.6
  },
  "provenance": {
    "onset": {
      "training": {
        "run_name": "country_week_onset_logit_30d",
        "artifact_path": "C:\\Users\\akgul\\Downloads\\codex_prompts_georisk\\georisk\\artifacts\\forecasting\\train\\country_week_onset_logit_30d",
        "completed_at": "2026-03-29T00:42:25.579899Z",
        "model_name": "logit"
      },
      "calibration": {
        "run_name": "country_week_onset_logit",
        "artifact_path": "C:\\Users\\akgul\\Downloads\\codex_prompts_georisk\\georisk\\artifacts\\forecasting\\calibration\\country_week_onset_logit",
        "completed_at": "2026-03-29T00:42:29.268499Z",
        "model_name": "logit"
      },
      "backtest": {
        "run_name": "country_week_onset_logit",
        "artifact_path": "C:\\Users\\akgul\\Downloads\\codex_prompts_georisk\\georisk\\artifacts\\backtesting\\run\\country_week_onset_logit",
        "completed_at": "2026-03-29T00:43:19.346184Z",
        "model_name": "logit"
      }
    },
    "escalation": {
      "training": {
        "run_name": "country_week_logit_30d",
        "artifact_path": "artifacts\\forecasting\\train\\country_week_logit_30d",
        "completed_at": "2026-03-29T00:42:42.984907Z",
        "model_name": "logit"
      },
      "calibration": {
        "run_name": "country_week_logit",
        "artifact_path": "artifacts\\forecasting\\calibration\\country_week_logit",
        "completed_at": "2026-03-29T00:42:46.566501Z",
        "model_name": "logit"
      },
      "backtest": {
        "run_name": "country_week_logit",
        "artifact_path": "artifacts\\backtesting\\run\\country_week_logit",
        "completed_at": "2026-03-29T00:43:45.933113Z",
        "model_name": "logit"
      }
    },
    "structural": {
      "training": {
        "run_name": "country_week_onset_structural_90d",
        "artifact_path": "artifacts\\forecasting\\train\\country_week_onset_structural_90d",
        "completed_at": "2026-03-29T00:41:38.494670Z",
        "model_name": "logit"
      },
      "calibration": {
        "run_name": "country_week_onset_structural_90d",
        "artifact_path": "artifacts\\forecasting\\calibration\\country_week_onset_structural_90d",
        "completed_at": "2026-03-29T00:41:42.094538Z",
        "model_name": "logit"
      },
      "backtest": {
        "run_name": "country_week_onset_structural_90d",
        "artifact_path": "artifacts\\backtesting\\run\\country_week_onset_structural_90d",
        "completed_at": "2026-03-29T00:42:16.600417Z",
        "model_name": "logit"
      }
    }
  }
}